{
  "run_id": "ablation_no_contr_vonly_tuned_loto_overwrite_seed2027",
  "config_hash": "44dc949f505f449ddf9b9e802908273fa9f3e9727777ad37423b028717bf3ddb",
  "metrics": {
    "stability.logit_sensitivity": [
      {
        "delta_norm": 0.0,
        "baseline": 0.0,
        "heuristics": 0.0,
        "cachemedic": 0.0,
        "cachemedic_no_contr": 0.0,
        "delta_pair_norm": 0.0,
        "delta_pair_rel_norm": 0.0,
        "delta_k_rel_norm": 0.0,
        "delta_v_rel_norm": 0.0
      },
      {
        "delta_norm": 1.0,
        "baseline": 5.468723876277606,
        "heuristics": 134.7157420794169,
        "cachemedic": 27.47714807242155,
        "cachemedic_no_contr": 27.47714807242155,
        "delta_pair_norm": 1.3848574844098038,
        "delta_pair_rel_norm": 0.0020945784706252767,
        "delta_k_rel_norm": 0.0020943037850253655,
        "delta_v_rel_norm": 0.002094782613555259
      },
      {
        "delta_norm": 2.0,
        "baseline": 6.639706199367841,
        "heuristics": 134.7157420794169,
        "cachemedic": 26.66451288710038,
        "cachemedic_no_contr": 26.66451288710038,
        "delta_pair_norm": 2.769347531308328,
        "delta_pair_rel_norm": 0.0041885899340935485,
        "delta_k_rel_norm": 0.0041882328432092915,
        "delta_v_rel_norm": 0.004189192165902149
      }
    ],
    "stability.amplification_map": {
      "layers": [
        8,
        9,
        10,
        11
      ],
      "heads": [
        0,
        1,
        2,
        3,
        4,
        5,
        6,
        7,
        8,
        9,
        10,
        11,
        12,
        13,
        14,
        15
      ],
      "baseline": [
        [
          2.648944139480591,
          2.6698663234710693,
          2.473297357559204,
          2.0733425617218018,
          2.4671945571899414,
          2.7413103580474854,
          2.271350622177124,
          2.167695999145508,
          2.3853588104248047,
          2.303615093231201,
          2.4588840007781982,
          2.1214606761932373,
          2.33528470993042,
          2.6463143825531006,
          2.399989604949951,
          2.3332438468933105
        ],
        [
          2.62143611907959,
          2.4733047485351562,
          2.7938740253448486,
          2.7361199855804443,
          2.6079254150390625,
          2.281877279281616,
          2.2813198566436768,
          2.6004526615142822,
          2.2811219692230225,
          2.5640602111816406,
          2.5245072841644287,
          2.4579544067382812,
          2.274949550628662,
          2.5018997192382812,
          2.2424206733703613,
          2.3290657997131348
        ],
        [
          2.3037190437316895,
          2.123199462890625,
          2.0334835052490234,
          2.4701995849609375,
          2.118516445159912,
          1.9040477275848389,
          2.148357391357422,
          2.138474702835083,
          2.478257179260254,
          2.046505928039551,
          2.7086005210876465,
          2.369246006011963,
          2.460850715637207,
          2.325925350189209,
          2.3040225505828857,
          2.214663505554199
        ],
        [
          1.9742722511291504,
          1.8291358947753906,
          1.9688745737075806,
          2.1816110610961914,
          1.950568437576294,
          1.8408311605453491,
          1.8116888999938965,
          1.7972776889801025,
          1.9189293384552002,
          1.7209964990615845,
          1.8518458604812622,
          1.8737568855285645,
          1.7249040603637695,
          1.886418342590332,
          1.7505536079406738,
          1.9584126472473145
        ]
      ],
      "cachemedic": [
        [
          2.648944139480591,
          2.6698663234710693,
          2.473297357559204,
          2.0733425617218018,
          2.4671945571899414,
          2.7413103580474854,
          2.271350622177124,
          2.167695999145508,
          2.3853588104248047,
          2.303615093231201,
          2.4588840007781982,
          2.1214606761932373,
          2.33528470993042,
          2.6463143825531006,
          2.399989604949951,
          2.3332438468933105
        ],
        [
          2.62143611907959,
          2.4733047485351562,
          2.7938740253448486,
          2.7361199855804443,
          2.6079254150390625,
          2.281877279281616,
          2.2813198566436768,
          2.6004526615142822,
          2.2811219692230225,
          2.5640602111816406,
          2.5245072841644287,
          2.4579544067382812,
          2.274949550628662,
          2.5018997192382812,
          2.2424206733703613,
          2.3290657997131348
        ],
        [
          6.883673667907715,
          7.211124897003174,
          6.740652561187744,
          7.070166110992432,
          6.883102893829346,
          7.113481044769287,
          7.263098239898682,
          7.786218166351318,
          7.208564758300781,
          6.055743217468262,
          6.864624977111816,
          7.1153693199157715,
          6.539953708648682,
          6.22749137878418,
          6.951964378356934,
          7.179448127746582
        ],
        [
          7.818235874176025,
          7.93501091003418,
          7.173283576965332,
          7.090488910675049,
          7.204117774963379,
          7.368381023406982,
          6.857873439788818,
          7.635440826416016,
          7.373565673828125,
          7.336448669433594,
          7.372534275054932,
          7.223748683929443,
          7.590203285217285,
          7.345394611358643,
          7.446739673614502,
          7.399534225463867
        ]
      ]
    },
    "stability.settings": {
      "num_prompts": 60,
      "num_directions": 4,
      "topk_logits": 512,
      "time_mode": "old_only",
      "N_recent": 32,
      "amplification_delta_norm": 1.0,
      "best_heuristic_name": "reset_clear",
      "checkpoint_loaded": true,
      "cachemedic_no_contr_source": "self",
      "delta_injection_shared_across_variants": true
    }
  },
  "settings": {
    "delta_norms": [
      0.0,
      1.0,
      2.0
    ],
    "layers": [
      8,
      9,
      10,
      11
    ],
    "heads": [
      0,
      1,
      2,
      3,
      4,
      5,
      6,
      7,
      8,
      9,
      10,
      11,
      12,
      13,
      14,
      15
    ]
  }
}
