{
  "run_id": "main_contr_vonly_tuned_loto_overwrite",
  "config_hash": "e11cc2a3d6c5f4ac84b9333e02d34d15c5517f517960001aa00e5854f4e7b692",
  "metrics": {
    "stability.logit_sensitivity": [
      {
        "delta_norm": 0.0,
        "baseline": 0.0,
        "heuristics": 0.0,
        "cachemedic": 0.0,
        "cachemedic_no_contr": 0.0,
        "delta_pair_norm": 0.0,
        "delta_pair_rel_norm": 0.0,
        "delta_k_rel_norm": 0.0,
        "delta_v_rel_norm": 0.0
      },
      {
        "delta_norm": 1.0,
        "baseline": 5.30313425163428,
        "heuristics": 32.33484030365944,
        "cachemedic": 48.70832327902317,
        "cachemedic_no_contr": 52.42502048313618,
        "delta_pair_norm": 1.3849217393344588,
        "delta_pair_rel_norm": 0.0020945751238782206,
        "delta_k_rel_norm": 0.002094321047832208,
        "delta_v_rel_norm": 0.0020946280899688243
      },
      {
        "delta_norm": 2.0,
        "baseline": 6.231232383350531,
        "heuristics": 32.723784706989925,
        "cachemedic": 49.41630453964074,
        "cachemedic_no_contr": 53.330753859380884,
        "delta_pair_norm": 2.76965707611004,
        "delta_pair_rel_norm": 0.004188871312142396,
        "delta_k_rel_norm": 0.004188552312317445,
        "delta_v_rel_norm": 0.004189191420242843
      }
    ],
    "stability.amplification_map": {
      "layers": [
        8,
        9,
        10,
        11
      ],
      "heads": [
        0,
        1,
        2,
        3,
        4,
        5,
        6,
        7,
        8,
        9,
        10,
        11,
        12,
        13,
        14,
        15
      ],
      "baseline": [
        [
          2.8314175605773926,
          2.332620859146118,
          2.3558671474456787,
          2.387479782104492,
          2.2624011039733887,
          2.520556688308716,
          2.3929548263549805,
          2.38102126121521,
          2.3421144485473633,
          2.8256731033325195,
          2.2736480236053467,
          2.5345993041992188,
          2.464360237121582,
          2.3416082859039307,
          2.659721612930298,
          2.364009380340576
        ],
        [
          2.4102940559387207,
          2.5221428871154785,
          2.306501865386963,
          2.6979024410247803,
          2.5483531951904297,
          2.4068353176116943,
          2.6507372856140137,
          2.1476008892059326,
          2.600205421447754,
          2.246511936187744,
          2.302432060241699,
          2.3306527137756348,
          2.550523042678833,
          2.2194571495056152,
          2.580702781677246,
          2.6837918758392334
        ],
        [
          2.304157018661499,
          2.388180732727051,
          2.435218095779419,
          2.092200756072998,
          2.1850438117980957,
          2.1969380378723145,
          2.257141351699829,
          2.4201602935791016,
          1.8808356523513794,
          2.119628667831421,
          2.1448235511779785,
          2.2386882305145264,
          2.332001209259033,
          1.9471714496612549,
          2.3745627403259277,
          1.9158470630645752
        ],
        [
          1.8771998882293701,
          1.8624155521392822,
          1.7197692394256592,
          1.9543672800064087,
          1.9526262283325195,
          1.9802327156066895,
          1.9363595247268677,
          1.8544741868972778,
          2.0096890926361084,
          1.8346537351608276,
          2.1183454990386963,
          2.0817506313323975,
          1.8046513795852661,
          1.8626036643981934,
          1.821751356124878,
          2.263746738433838
        ]
      ],
      "cachemedic": [
        [
          2.8314175605773926,
          2.332620859146118,
          2.3558671474456787,
          2.387479782104492,
          2.2624011039733887,
          2.520556688308716,
          2.3929548263549805,
          2.38102126121521,
          2.3421144485473633,
          2.8256731033325195,
          2.2736480236053467,
          2.5345993041992188,
          2.464360237121582,
          2.3416082859039307,
          2.659721612930298,
          2.364009380340576
        ],
        [
          2.4102940559387207,
          2.5221428871154785,
          2.306501865386963,
          2.6979024410247803,
          2.5483531951904297,
          2.4068353176116943,
          2.6507372856140137,
          2.1476008892059326,
          2.600205421447754,
          2.246511936187744,
          2.302432060241699,
          2.3306527137756348,
          2.550523042678833,
          2.2194571495056152,
          2.580702781677246,
          2.6837918758392334
        ],
        [
          6.566680431365967,
          6.704235553741455,
          6.5254645347595215,
          6.920000076293945,
          6.734222888946533,
          6.361269474029541,
          6.792767524719238,
          6.949587821960449,
          6.768500328063965,
          5.82716178894043,
          6.161218166351318,
          7.1568756103515625,
          7.164339542388916,
          6.371809005737305,
          6.484577655792236,
          6.6313934326171875
        ],
        [
          8.182180404663086,
          8.361479759216309,
          8.630986213684082,
          8.167801856994629,
          8.363001823425293,
          7.891622543334961,
          7.669088363647461,
          7.964037895202637,
          9.309130668640137,
          8.597610473632812,
          8.294334411621094,
          8.54339599609375,
          8.457833290100098,
          7.9864020347595215,
          8.416190147399902,
          8.368595123291016
        ]
      ]
    },
    "stability.settings": {
      "num_prompts": 60,
      "num_directions": 4,
      "topk_logits": 512,
      "time_mode": "old_only",
      "N_recent": 32,
      "amplification_delta_norm": 1.0,
      "best_heuristic_name": "smoothing",
      "checkpoint_loaded": true,
      "cachemedic_no_contr_source": "E:\\Research\\cachemedic_pp_harness_v1_1\\cachemedic_pp_harness\\empty_dirs_for_codex\\outputs\\runs_recovery\\recovery_vonly_sweep_v1\\ablation_no_contr_vonly_tuned_loto_overwrite",
      "delta_injection_shared_across_variants": true
    }
  },
  "settings": {
    "delta_norms": [
      0.0,
      1.0,
      2.0
    ],
    "layers": [
      8,
      9,
      10,
      11
    ],
    "heads": [
      0,
      1,
      2,
      3,
      4,
      5,
      6,
      7,
      8,
      9,
      10,
      11,
      12,
      13,
      14,
      15
    ]
  }
}
