{
  "run_id": "main_contr_loto_holdout_overwrite",
  "config_hash": "ca6098e5649b32335d169cae5ac7f80cab09962cf4ba6932a9cd6d3af526afe7",
  "metrics": {
    "stability.logit_sensitivity": [
      {
        "delta_norm": 0.0,
        "baseline": 0.0,
        "heuristics": 0.0,
        "cachemedic": 0.0,
        "cachemedic_no_contr": 0.0
      },
      {
        "delta_norm": 1.0,
        "baseline": 5.5845885768532755,
        "heuristics": 37.81793159484863,
        "cachemedic": 100.49091882109641,
        "cachemedic_no_contr": 88.64545386910439
      },
      {
        "delta_norm": 2.0,
        "baseline": 6.377884519696235,
        "heuristics": 38.140119557976725,
        "cachemedic": 100.20079251408578,
        "cachemedic_no_contr": 88.6054272955656
      }
    ],
    "stability.amplification_map": {
      "layers": [
        8,
        9,
        10,
        11
      ],
      "heads": [
        0,
        1,
        2,
        3,
        4,
        5,
        6,
        7,
        8,
        9,
        10,
        11,
        12,
        13,
        14,
        15
      ],
      "baseline": [
        [
          2.7620389461517334,
          2.5071630477905273,
          2.457468271255493,
          2.387479782104492,
          2.3955700397491455,
          2.4758434295654297,
          2.5429675579071045,
          2.447711944580078,
          2.484144926071167,
          2.9014792442321777,
          2.530811309814453,
          2.560497760772705,
          2.783963203430176,
          2.5205206871032715,
          2.7016656398773193,
          2.421887159347534
        ],
        [
          2.667623281478882,
          2.6961591243743896,
          2.4227309226989746,
          2.6854867935180664,
          2.5483531951904297,
          2.555140733718872,
          2.555873394012451,
          2.3960845470428467,
          2.546846628189087,
          2.4135658740997314,
          2.514693021774292,
          2.5450611114501953,
          2.7325668334960938,
          2.380674123764038,
          2.707552909851074,
          2.6208412647247314
        ],
        [
          2.44602632522583,
          2.3126425743103027,
          2.4043471813201904,
          2.4272379875183105,
          2.4159979820251465,
          2.295381784439087,
          2.3344414234161377,
          2.4541776180267334,
          2.281581401824951,
          2.3106133937835693,
          2.418707847595215,
          2.416951894760132,
          2.282244920730591,
          2.3076627254486084,
          2.5021183490753174,
          2.213332176208496
        ],
        [
          1.9296948909759521,
          1.9230693578720093,
          1.9265090227127075,
          1.9096485376358032,
          2.1281425952911377,
          2.103023052215576,
          1.9764701128005981,
          1.997944951057434,
          2.048609972000122,
          2.110999345779419,
          2.1564605236053467,
          2.0390806198120117,
          1.9671860933303833,
          2.0432207584381104,
          1.9976568222045898,
          2.263746738433838
        ]
      ],
      "cachemedic": [
        [
          17.87638282775879,
          17.99139404296875,
          18.648488998413086,
          18.326078414916992,
          18.126022338867188,
          18.40220069885254,
          18.308692932128906,
          18.03599739074707,
          16.97581672668457,
          18.66790771484375,
          17.678781509399414,
          19.133594512939453,
          17.697673797607422,
          18.306215286254883,
          17.74715232849121,
          18.34114646911621
        ],
        [
          20.018341064453125,
          20.065223693847656,
          20.135900497436523,
          20.339269638061523,
          20.013582229614258,
          21.934968948364258,
          20.564594268798828,
          19.86890983581543,
          20.648468017578125,
          20.44229507446289,
          20.061716079711914,
          20.310686111450195,
          20.87498664855957,
          20.170146942138672,
          20.84543800354004,
          20.522937774658203
        ],
        [
          12.151468276977539,
          11.895787239074707,
          12.355645179748535,
          11.703207969665527,
          11.894184112548828,
          11.52816104888916,
          12.15872859954834,
          12.455748558044434,
          12.637272834777832,
          11.948229789733887,
          11.25571060180664,
          11.938272476196289,
          11.446815490722656,
          12.143766403198242,
          11.671331405639648,
          11.229422569274902
        ],
        [
          8.462972640991211,
          7.833573818206787,
          7.865824222564697,
          8.2184419631958,
          7.860246181488037,
          7.992192268371582,
          7.829586982727051,
          7.69271993637085,
          8.015679359436035,
          8.312335014343262,
          8.247390747070312,
          7.99487829208374,
          8.36636734008789,
          7.999061107635498,
          8.50383472442627,
          8.0396089553833
        ]
      ]
    },
    "stability.settings": {
      "num_prompts": 100,
      "num_directions": 4,
      "topk_logits": 512,
      "time_mode": "old_only",
      "N_recent": 32,
      "amplification_delta_norm": 1.0,
      "best_heuristic_name": "smoothing",
      "checkpoint_loaded": true,
      "cachemedic_no_contr_source": "E:\\Research\\cachemedic_pp_harness_v1_1\\cachemedic_pp_harness\\empty_dirs_for_codex\\outputs\\runs_fast_paper_core\\fast_paper_sweep_core_v1\\ablation_no_contr_loto_holdout_overwrite"
    }
  },
  "settings": {
    "delta_norms": [
      0.0,
      1.0,
      2.0
    ],
    "layers": [
      8,
      9,
      10,
      11
    ],
    "heads": [
      0,
      1,
      2,
      3,
      4,
      5,
      6,
      7,
      8,
      9,
      10,
      11,
      12,
      13,
      14,
      15
    ]
  }
}
