{
  "run_id": "main_contr_vonly_tuned_loto_overwrite_seed2028",
  "config_hash": "83e62afe6f12ae00505312eafdbfde66ca9c0aed8a4a7cc19b8991765b674519",
  "metrics": {
    "stability.logit_sensitivity": [
      {
        "delta_norm": 0.0,
        "baseline": 0.0,
        "heuristics": 0.0,
        "cachemedic": 0.0,
        "cachemedic_no_contr": null,
        "delta_pair_norm": 0.0,
        "delta_pair_rel_norm": 0.0,
        "delta_k_rel_norm": 0.0,
        "delta_v_rel_norm": 0.0
      },
      {
        "delta_norm": 1.0,
        "baseline": 5.982489338020484,
        "heuristics": 33.5451447447141,
        "cachemedic": 21.850182246168455,
        "cachemedic_no_contr": null,
        "delta_pair_norm": 1.3850789612378624,
        "delta_pair_rel_norm": 0.0020947154767704274,
        "delta_k_rel_norm": 0.0020945096816548238,
        "delta_v_rel_norm": 0.002094588876651212
      },
      {
        "delta_norm": 2.0,
        "baseline": 6.0900542045633,
        "heuristics": 33.96300600767135,
        "cachemedic": 21.793245631456376,
        "cachemedic_no_contr": null,
        "delta_pair_norm": 2.7703197235461023,
        "delta_pair_rel_norm": 0.0041893681204209525,
        "delta_k_rel_norm": 0.004189244024842733,
        "delta_v_rel_norm": 0.004188777014122848
      }
    ],
    "stability.amplification_map": {
      "layers": [
        8,
        9,
        10,
        11
      ],
      "heads": [
        0,
        1,
        2,
        3,
        4,
        5,
        6,
        7,
        8,
        9,
        10,
        11,
        12,
        13,
        14,
        15
      ],
      "baseline": [
        [
          2.587717294692993,
          2.037828207015991,
          2.626932382583618,
          2.621483325958252,
          2.598792552947998,
          2.7009410858154297,
          2.5737199783325195,
          2.4029107093811035,
          2.293229103088379,
          2.335709571838379,
          2.1293654441833496,
          2.8607659339904785,
          2.3704051971435547,
          2.438209295272827,
          2.541285514831543,
          2.342846393585205
        ],
        [
          2.1136415004730225,
          2.4461066722869873,
          2.6968271732330322,
          2.2691636085510254,
          2.4160799980163574,
          2.2680790424346924,
          2.5079855918884277,
          2.4576992988586426,
          2.475308656692505,
          2.4897279739379883,
          2.5655176639556885,
          2.619266986846924,
          2.693237781524658,
          2.715729236602783,
          2.601238250732422,
          2.6467080116271973
        ],
        [
          2.1368064880371094,
          2.096806049346924,
          2.285398006439209,
          2.318347215652466,
          2.2450711727142334,
          2.1731600761413574,
          2.1684863567352295,
          2.527585744857788,
          2.241483449935913,
          2.0595664978027344,
          2.3238139152526855,
          2.480410099029541,
          2.2748563289642334,
          2.1731197834014893,
          2.004835605621338,
          2.524068832397461
        ],
        [
          1.8720314502716064,
          1.7415714263916016,
          1.966130018234253,
          2.0717482566833496,
          2.1197524070739746,
          2.1654303073883057,
          1.820404291152954,
          2.0640316009521484,
          1.8016444444656372,
          1.8485801219940186,
          2.1047558784484863,
          1.7378300428390503,
          1.8640660047531128,
          1.9834636449813843,
          1.8379249572753906,
          2.0730741024017334
        ]
      ],
      "cachemedic": [
        [
          2.587717294692993,
          2.037828207015991,
          2.626932382583618,
          2.621483325958252,
          2.598792552947998,
          2.7009410858154297,
          2.5737199783325195,
          2.4029107093811035,
          2.293229103088379,
          2.335709571838379,
          2.1293654441833496,
          2.8607659339904785,
          2.3704051971435547,
          2.438209295272827,
          2.541285514831543,
          2.342846393585205
        ],
        [
          2.1136415004730225,
          2.4461066722869873,
          2.6968271732330322,
          2.2691636085510254,
          2.4160799980163574,
          2.2680790424346924,
          2.5079855918884277,
          2.4576992988586426,
          2.475308656692505,
          2.4897279739379883,
          2.5655176639556885,
          2.619266986846924,
          2.693237781524658,
          2.715729236602783,
          2.601238250732422,
          2.6467080116271973
        ],
        [
          8.034377098083496,
          7.9187774658203125,
          8.671265602111816,
          7.948622226715088,
          7.877261638641357,
          8.933457374572754,
          8.142010688781738,
          7.693230152130127,
          6.779447555541992,
          8.337516784667969,
          7.705677032470703,
          7.606033802032471,
          8.304020881652832,
          7.742992401123047,
          8.01816177368164,
          8.305604934692383
        ],
        [
          9.503973960876465,
          8.876728057861328,
          9.437788963317871,
          8.806779861450195,
          8.670053482055664,
          8.97746467590332,
          9.496644973754883,
          9.252089500427246,
          9.006503105163574,
          9.340713500976562,
          9.930414199829102,
          8.83613109588623,
          9.358749389648438,
          8.814033508300781,
          9.264163970947266,
          9.13325309753418
        ]
      ]
    },
    "stability.settings": {
      "num_prompts": 60,
      "num_directions": 4,
      "topk_logits": 512,
      "time_mode": "old_only",
      "N_recent": 32,
      "amplification_delta_norm": 1.0,
      "best_heuristic_name": "masking_dropout",
      "checkpoint_loaded": true,
      "cachemedic_no_contr_source": "missing_pair",
      "delta_injection_shared_across_variants": true
    }
  },
  "settings": {
    "delta_norms": [
      0.0,
      1.0,
      2.0
    ],
    "layers": [
      8,
      9,
      10,
      11
    ],
    "heads": [
      0,
      1,
      2,
      3,
      4,
      5,
      6,
      7,
      8,
      9,
      10,
      11,
      12,
      13,
      14,
      15
    ]
  }
}
